{
  "rule_id": "rule.multi-agent-ai.require-approval-large-swarm",
  "rule_name": "Require approval when more than three delegated agents are scheduled",
  "rule_type": "approval_trigger",
  "condition": {
    "field": "proposed_action.parameters.delegated_agent_count",
    "operator": ">",
    "value": 3
  },
  "outcome": "require_approval",
  "evaluation_mode": "deterministic",
  "created_at": "2026-03-23T14:02:00Z",
  "version": 1
}
