{
  "rule_id": "rule.power-grid.require-approval-customer-interruptions",
  "rule_name": "Require approval before large-scale customer interruptions",
  "rule_type": "approval_trigger",
  "condition": {
    "field": "proposed_action.parameters.customer_interruptions",
    "operator": ">",
    "value": 10000
  },
  "outcome": "require_approval",
  "evaluation_mode": "deterministic",
  "created_at": "2026-03-23T11:00:00Z",
  "version": 1
}
