{
  "rule_id": "rule.air-traffic.require-simulation-evidence",
  "rule_name": "Require simulation evidence before constrained reroutes",
  "rule_type": "approval_trigger",
  "condition": {
    "field": "proposed_action.parameters.simulation_completed",
    "operator": "equals",
    "value": false
  },
  "outcome": "require_approval",
  "evaluation_mode": "deterministic",
  "created_at": "2026-03-09T08:00:00Z",
  "version": 1
}
