{
  "rule_id": "rule.autonomous-vehicle.require-approval-creep-speed",
  "rule_name": "Require approval when supervised creep exceeds the low-speed envelope",
  "rule_type": "approval_trigger",
  "condition": {
    "field": "proposed_action.parameters.planned_speed_kph",
    "operator": ">",
    "value": 15
  },
  "outcome": "require_approval",
  "evaluation_mode": "deterministic",
  "created_at": "2026-03-23T13:14:00Z",
  "version": 1
}
