{
  "rule_id": "rule.market-micro.require-approval-thin-headroom",
  "rule_name": "Require approval when inventory headroom is critically thin",
  "rule_type": "approval_trigger",
  "condition": {
    "field": "proposed_action.parameters.projected_limit_utilization_percent",
    "operator": ">",
    "value": 90
  },
  "outcome": "require_approval",
  "evaluation_mode": "deterministic",
  "created_at": "2026-03-23T12:20:00Z",
  "version": 1
}
