{
  "rule_id": "rule.supply-ops.require-approval-expedite-premium",
  "rule_name": "Require approval for high expedite premium",
  "rule_type": "approval_trigger",
  "condition": {
    "field": "proposed_action.parameters.expedite_cost_delta_percent",
    "operator": ">",
    "value": 12
  },
  "outcome": "require_approval",
  "evaluation_mode": "deterministic",
  "created_at": "2026-03-22T09:00:00Z",
  "version": 1
}
